{
  "abnormalStopRecoveryCycle": true,
  "allowsCaseContract": false,
  "automaticPromotion": false,
  "boundary": "Two source-bound meaningful-wrong variants were built and killed by the same external layout Oracle between isolated pre/post reference controls on one HarmonyOS 7 API 26 x86_64 emulator. This qualifies abnormal recovery discrimination only; it does not qualify normal-exit behavior, exact API 22 runtime, real-device behavior, performance, power, thermal or the case contract.",
  "candidateId": "shadow-case-uiability-backup-restore-state-recovery",
  "exactApi22Runtime": false,
  "identityIsolationVerified": true,
  "independentOracleExecuted": true,
  "killedVariantCount": 2,
  "mutationCalibrationSha256": "162e7194e1a3d42c68d3ddb3ec51be2c0c7c493a327f72d1bc6f895cfe74cf53",
  "mutationScore": 1.0,
  "nextGate": "normal-exit-negative-control-on-independent-bundle-identity",
  "normalExitNegativeControl": false,
  "planSha256": "c9b1d35bbdd5029f76a0526ece1271f9b40acebfdf341d73af872c23c9752ec2",
  "referenceRuntimeReceiptSha256": "ae6f49eefb0d8478ff7c23ac802bb9f614ea0712b51c4714b900f5d72fb97bb9",
  "referenceSandwichVerified": true,
  "schema": "agentlab.uiability_recovery_mutation_qualification.v1",
  "source": {
    "bindings": [
      {
        "byteLength": 3070,
        "gitBlobOid": "2e29fbdd76d0e67a0fd785cae3a76bf3fd927d14",
        "path": "Ability/UIAbilityRecover/entry/src/main/ets/entryability/EntryAbility.ets",
        "sha256": "bce3999d4a8a8c7acde6a5da8dcc5d2c03f9dd14afdd9beb7dec9e22fa496b86"
      },
      {
        "byteLength": 1174,
        "gitBlobOid": "0f481f696485b8c840d49ad9e7d7dff7f6b71241",
        "path": "Ability/UIAbilityRecover/entry/src/main/ets/pages/Index.ets",
        "sha256": "b619ea93d1af6fa44083f7e32b0fbd50b291fdc2edbd28c4bc16a9f9f2253df7"
      },
      {
        "byteLength": 2400,
        "gitBlobOid": "f111bae87244153c838f726427c46a02fcfac2a6",
        "path": "Ability/UIAbilityRecover/entry/src/ohosTest/ets/test/Ability.test.ets",
        "sha256": "f4b92cbb1e48f427e588b503c98ea34052586ab60fa196b153aa0639f5e0b7b4"
      }
    ],
    "repositoryId": "guide-snippets",
    "revision": "71bbb3916625c8d9a370b7a1989b3a7f82090525",
    "treeOid": "20bc24c3933662e0f7a55022bf918015407a94b2"
  },
  "status": "mutation-discrimination-qualified-normal-exit-negative-control-required",
  "variantCount": 2
}
